{"payload":{"archive_envelope_sha256":"c313bf2f229863b19a889f88d74f81ea627dc589d8ba10de6fa1846f2acfe7d8","archive_observation_id":"mast-27707-complete-magnetics-edb5dfecf4d905fe","array_inventory":[{"clock_dimensions":[],"dimension_names":["b_field_pol_probe_cc_channel"],"name":"b_field_pol_probe_cc_channel","role":"channel_coordinate","shape":[5]},{"clock_dimensions":["time_mirnov"],"dimension_names":["b_field_pol_probe_cc_channel","time_mirnov"],"name":"b_field_pol_probe_cc_field","role":"measurement","shape":[5,215051]},{"clock_dimensions":[],"dimension_names":["b_field_pol_probe_cc_geometry_channel"],"name":"b_field_pol_probe_cc_geometry_channel","role":"channel_coordinate","shape":[40]},{"clock_dimensions":[],"dimension_names":["b_field_pol_probe_cc_geometry_channel"],"name":"b_field_pol_probe_cc_phi","role":"geometry","shape":[40]},{"clock_dimensions":[],"dimension_names":["b_field_pol_probe_cc_geometry_channel"],"name":"b_field_pol_probe_cc_r","role":"geometry","shape":[40]},{"clock_dimensions":[],"dimension_names":["b_field_pol_probe_cc_geometry_channel"],"name":"b_field_pol_probe_cc_z","role":"geometry","shape":[40]},{"clock_dimensions":[],"dimension_names":["b_field_pol_probe_ccbv_channel"],"name":"b_field_pol_probe_ccbv_channel","role":"channel_coordinate","shape":[40]},{"clock_dimensions":["time"],"dimension_names":["b_field_pol_probe_ccbv_channel","time"],"name":"b_field_pol_probe_ccbv_field","role":"measurement","shape":[40,2152]},{"clock_dimensions":[],"dimension_names":["b_field_pol_probe_ccbv_geometry_channel"],"name":"b_field_pol_probe_ccbv_geometry_channel","role":"channel_coordinate","shape":[40]},{"clock_dimensions":[],"dimension_names":["b_field_pol_probe_ccbv_geometry_channel"],"name":"b_field_pol_probe_ccbv_length","role":"geometry","shape":[40]},{"clock_dimensions":[],"dimension_names":["b_field_pol_probe_ccbv_geometry_channel"],"name":"b_field_pol_probe_ccbv_phi_1","role":"geometry","shape":[40]},{"clock_dimensions":[],"dimension_names":["b_field_pol_probe_ccbv_geometry_channel"],"name":"b_field_pol_probe_ccbv_phi_2","role":"geometry","shape":[40]},{"clock_dimensions":[],"dimension_names":["b_field_pol_probe_ccbv_geometry_channel"],"name":"b_field_pol_probe_ccbv_r","role":"geometry","shape":[40]},{"clock_dimensions":[],"dimension_names":["b_field_pol_probe_ccbv_geometry_channel"],"name":"b_field_pol_probe_ccbv_z","role":"geometry","shape":[40]},{"clock_dimensions":[],"dimension_names":["b_field_pol_probe_obr_channel"],"name":"b_field_pol_probe_obr_channel","role":"channel_coordinate","shape":[19]},{"clock_dimensions":["time"],"dimension_names":["b_field_pol_probe_obr_channel","time"],"name":"b_field_pol_probe_obr_field","role":"measurement","shape":[19,2152]},{"clock_dimensions":[],"dimension_names":["b_field_pol_probe_obr_geometry_channel"],"name":"b_field_pol_probe_obr_geometry_channel","role":"channel_coordinate","shape":[19]},{"clock_dimensions":[],"dimension_names":["b_field_pol_probe_obr_geometry_channel"],"name":"b_field_pol_probe_obr_length","role":"geometry","shape":[19]},{"clock_dimensions":[],"dimension_names":["b_field_pol_probe_obr_geometry_channel"],"name":"b_field_pol_probe_obr_phi_1","role":"geometry","shape":[19]},{"clock_dimensions":[],"dimension_names":["b_field_pol_probe_obr_geometry_channel"],"name":"b_field_pol_probe_obr_phi_2","role":"geometry","shape":[19]},{"clock_dimensions":[],"dimension_names":["b_field_pol_probe_obr_geometry_channel"],"name":"b_field_pol_probe_obr_r","role":"geometry","shape":[19]},{"clock_dimensions":[],"dimension_names":["b_field_pol_probe_obr_geometry_channel"],"name":"b_field_pol_probe_obr_z","role":"geometry","shape":[19]},{"clock_dimensions":[],"dimension_names":["b_field_pol_probe_obv_channel"],"name":"b_field_pol_probe_obv_channel","role":"channel_coordinate","shape":[19]},{"clock_dimensions":["time"],"dimension_names":["b_field_pol_probe_obv_channel","time"],"name":"b_field_pol_probe_obv_field","role":"measurement","shape":[19,2152]},{"clock_dimensions":[],"dimension_names":["b_field_pol_probe_obv_geometry_channel"],"name":"b_field_pol_probe_obv_geometry_channel","role":"channel_coordinate","shape":[19]},{"clock_dimensions":[],"dimension_names":["b_field_pol_probe_obv_geometry_channel"],"name":"b_field_pol_probe_obv_length","role":"geometry","shape":[19]},{"clock_dimensions":[],"dimension_names":["b_field_pol_probe_obv_geometry_channel"],"name":"b_field_pol_probe_obv_phi_1","role":"geometry","shape":[19]},{"clock_dimensions":[],"dimension_names":["b_field_pol_probe_obv_geometry_channel"],"name":"b_field_pol_probe_obv_phi_2","role":"geometry","shape":[19]},{"clock_dimensions":[],"dimension_names":["b_field_pol_probe_obv_geometry_channel"],"name":"b_field_pol_probe_obv_r","role":"geometry","shape":[19]},{"clock_dimensions":[],"dimension_names":["b_field_pol_probe_obv_geometry_channel"],"name":"b_field_pol_probe_obv_z","role":"geometry","shape":[19]},{"clock_dimensions":[],"dimension_names":["b_field_pol_probe_omv_channel"],"name":"b_field_pol_probe_omv_channel","role":"channel_coordinate","shape":[3]},{"clock_dimensions":[],"dimension_names":["b_field_pol_probe_omv_geometry_channel"],"name":"b_field_pol_probe_omv_geometry_channel","role":"channel_coordinate","shape":[21]},{"clock_dimensions":[],"dimension_names":["b_field_pol_probe_omv_geometry_channel"],"name":"b_field_pol_probe_omv_phi","role":"geometry","shape":[21]},{"clock_dimensions":[],"dimension_names":["b_field_pol_probe_omv_geometry_channel"],"name":"b_field_pol_probe_omv_r","role":"geometry","shape":[21]},{"clock_dimensions":["time_mirnov"],"dimension_names":["b_field_pol_probe_omv_channel","time_mirnov"],"name":"b_field_pol_probe_omv_voltage","role":"measurement","shape":[3,215051]},{"clock_dimensions":[],"dimension_names":["b_field_pol_probe_omv_geometry_channel"],"name":"b_field_pol_probe_omv_z","role":"geometry","shape":[21]},{"clock_dimensions":[],"dimension_names":["b_field_tor_probe_cc_channel"],"name":"b_field_tor_probe_cc_channel","role":"channel_coordinate","shape":[3]},{"clock_dimensions":["time_mirnov"],"dimension_names":["b_field_tor_probe_cc_channel","time_mirnov"],"name":"b_field_tor_probe_cc_field","role":"measurement","shape":[3,215051]},{"clock_dimensions":[],"dimension_names":["b_field_tor_probe_cc_geometry_channel"],"name":"b_field_tor_probe_cc_geometry_channel","role":"channel_coordinate","shape":[36]},{"clock_dimensions":[],"dimension_names":["b_field_tor_probe_cc_geometry_channel"],"name":"b_field_tor_probe_cc_phi","role":"geometry","shape":[36]},{"clock_dimensions":[],"dimension_names":["b_field_tor_probe_cc_geometry_channel"],"name":"b_field_tor_probe_cc_r","role":"geometry","shape":[36]},{"clock_dimensions":[],"dimension_names":["b_field_tor_probe_cc_geometry_channel"],"name":"b_field_tor_probe_cc_z","role":"geometry","shape":[36]},{"clock_dimensions":[],"dimension_names":["b_field_tor_probe_omaha_channel"],"name":"b_field_tor_probe_omaha_channel","role":"channel_coordinate","shape":[4]},{"clock_dimensions":["time_omaha"],"dimension_names":["b_field_tor_probe_omaha_channel","time_omaha"],"name":"b_field_tor_probe_omaha_voltage","role":"measurement","shape":[4,860201]},{"clock_dimensions":["time_saddle"],"dimension_names":["b_field_tor_probe_saddle_field_channel","time_saddle"],"name":"b_field_tor_probe_saddle_field","role":"measurement","shape":[12,21506]},{"clock_dimensions":[],"dimension_names":["b_field_tor_probe_saddle_field_channel"],"name":"b_field_tor_probe_saddle_field_channel","role":"channel_coordinate","shape":[12]},{"clock_dimensions":[],"dimension_names":["b_field_tor_probe_saddle_l_geometry_channel"],"name":"b_field_tor_probe_saddle_l_geometry_channel","role":"channel_coordinate","shape":[12]},{"clock_dimensions":[],"dimension_names":["b_field_tor_probe_saddle_l_geometry_channel","coordinate"],"name":"b_field_tor_probe_saddle_l_phi","role":"geometry","shape":[12,28]},{"clock_dimensions":[],"dimension_names":["b_field_tor_probe_saddle_l_geometry_channel","coordinate"],"name":"b_field_tor_probe_saddle_l_r","role":"geometry","shape":[12,28]},{"clock_dimensions":[],"dimension_names":["b_field_tor_probe_saddle_l_geometry_channel","coordinate"],"name":"b_field_tor_probe_saddle_l_z","role":"geometry","shape":[12,28]},{"clock_dimensions":[],"dimension_names":["b_field_tor_probe_saddle_m_geometry_channel"],"name":"b_field_tor_probe_saddle_m_geometry_channel","role":"channel_coordinate","shape":[12]},{"clock_dimensions":[],"dimension_names":["b_field_tor_probe_saddle_m_geometry_channel","coordinate"],"name":"b_field_tor_probe_saddle_m_phi","role":"geometry","shape":[12,28]},{"clock_dimensions":[],"dimension_names":["b_field_tor_probe_saddle_m_geometry_channel","coordinate"],"name":"b_field_tor_probe_saddle_m_r","role":"geometry","shape":[12,28]},{"clock_dimensions":[],"dimension_names":["b_field_tor_probe_saddle_m_geometry_channel","coordinate"],"name":"b_field_tor_probe_saddle_m_z","role":"geometry","shape":[12,28]},{"clock_dimensions":[],"dimension_names":["b_field_tor_probe_saddle_u_geometry_channel"],"name":"b_field_tor_probe_saddle_u_geometry_channel","role":"channel_coordinate","shape":[12]},{"clock_dimensions":[],"dimension_names":["b_field_tor_probe_saddle_u_geometry_channel","coordinate"],"name":"b_field_tor_probe_saddle_u_phi","role":"geometry","shape":[12,28]},{"clock_dimensions":[],"dimension_names":["b_field_tor_probe_saddle_u_geometry_channel","coordinate"],"name":"b_field_tor_probe_saddle_u_r","role":"geometry","shape":[12,28]},{"clock_dimensions":[],"dimension_names":["b_field_tor_probe_saddle_u_geometry_channel","coordinate"],"name":"b_field_tor_probe_saddle_u_z","role":"geometry","shape":[12,28]},{"clock_dimensions":["time_saddle"],"dimension_names":["b_field_tor_probe_saddle_voltage_channel","time_saddle"],"name":"b_field_tor_probe_saddle_voltage","role":"measurement","shape":[12,21506]},{"clock_dimensions":[],"dimension_names":["b_field_tor_probe_saddle_voltage_channel"],"name":"b_field_tor_probe_saddle_voltage_channel","